emotion,quotes
inspiration,"Music has always been a matter of Energy to me, a question of Fuel. Sentimental people call it Inspiration, but what they really mean is Fuel. I have always needed Fuel. I am a serious consumer. On some nights I still believe that a car with the gas needle on empty can run about fifty more miles if you have the right music very loud on the radio."
inspiration,"Why do they always teach us that it's easy and evil to do what we want and that we need discipline to restrain ourselves? It's the hardest thing in the world--to do what we want. And it takes the greatest kind of courage. I mean, what we really want."
inspiration,Risks must be taken because the greatest hazard in life is to risk nothing.
inspiration,"The biggest wall you have to climb is the one you build in your mind: Never let your mind talk you out of your dreams, trick you into giving up. Never let your mind become the greatest obstacle to success. To get your mind on the right track, the rest will follow."
inspiration,Smile more. Smiling can make you and others happy.
inspiration,"Maturity is when you stop complaining and making excuses, and start making changes."
inspiration,"Never stop dreaming, never stop believing, never give up, never stop trying, and never stop learning."
inspiration,Strong people have a strong sense of self-worth and self-awareness; they don’t need the approval of others.
inspiration,I never made one of my discoveries through the process of rational thinking
inspiration,Sometimes all a person wants is an empathetic ear; all he or she needs is to talk it out. Just offering a listening ear and an understanding heart for his or her suffering can be a big comfort.
inspiration,"When the going gets tough, put one foot in front of the other and just keep going. Don’t give up."
inspiration,"Everyone you meet is a part of your journey, but not all of them are meant to stay in your life. Some people are just passing through to bring you gifts; either they're blessings or lessons."
inspiration,The problem with people is they forget that most of the time it's the small things that count.
inspiration,"Nothing is original. Steal from anywhere that resonates with inspiration or fuels your imagination. Devour old films, new films, music, books, paintings, photographs, poems, dreams, random conversations, architecture, bridges, street signs, trees, clouds, bodies of water, light and shadows. Select only things to steal from that speak directly to your soul. If you do this, your work (and theft) will be authentic. Authenticity is invaluable; originality is non-existent. And don’t bother concealing your thievery - celebrate it if you feel like it. In any case, always remember what Jean-Luc Godard said: “It’s not where you take things from - it’s where you take them to.""[MovieMaker Magazine #53 - Winter, January 22, 2004 ]"
inspiration,"When all is said and done, more is said than done."
inspiration,There is no dishonor in losing the race. There is only dishonor in not racing because you are afraid to lose.
inspiration,"Count your blessings, not your problems. Count your own blessings, not someone else's. Remember that jealousy is when you count someone else's blessings instead of your own."
inspiration,"Stop giving other people the power to control your happiness, your mind, and your life. If you don't take control of yourself and your own life, someone else is bound to try."
inspiration,All the effort in the world won't matter if you're not inspired.
inspiration,"Aerodynamically, the bumble bee shouldn't be able to fly, but the bumble bee doesn't know it so it goes on flying anyway."
inspiration,"When you're at the end of your rope, tie a knot and hold on."
inspiration,"You must not ever stop being whimsical. And you must not, ever, give anyone else the responsibility for your life."
inspiration,"Even if I knew that tomorrow the world would go to pieces, I would still plant my apple tree."
inspiration,"If you're going to be crazy, you have to get paid for it or else you're going to be locked up."
inspiration,With the new day comes new strength and new thoughts.
inspiration,"The strongest people find the courage and caring to help others, even if they are going through their own storm."
inspiration,You'll never get ahead of anyone as long as you try to get even with him.
inspiration,"I'm not in search of sanctity, sacredness, purity; these things are found after this life, not in this life; but in this life I search to be completely human: to feel, to give, to take, to laugh, to get lost, to be found, to dance, to love and to lust, to be so human."
