emotion,quotes
love,"I cannot fix on the hour, or the spot, or the look or the words, which laid the foundation. It is too long ago. I was in the middle before I knew that I had begun."
love,"It hurts to let go. Sometimes it seems the harder you try to hold on to something or someone the more it wants to get away. You feel like some kind of criminal for having felt, for having wanted. For having wanted to be wanted. It confuses you, because you think that your feelings were wrong and it makes you feel so small because it's so hard to keep it inside when you let it out and it doesn't coma back. You're left so alone that you can't explain. Damn, there's nothing like that, is there? I've been there and you have too. You're nodding your head."
love,"Love does not consist of gazing at each other, but in looking outward together in the same direction."
love,"And, in the endThe love you takeis equal to the love you make."
love,"I don't trust people who don't love themselves and tell me, 'I love you.' ... There is an African saying which is: Be careful when a naked person offers you a shirt."
love,"If he’s not calling you, it’s because you are not on his mind. If he creates expectations for you, and then doesn’t follow through on little things, he will do same for big things. Be aware of this and realize that he’s okay with disappointing you. Don’t be with someone who doesn’t do what they say they’re going to do. If he’s choosing not to make a simple effort that would put you at ease and bring harmony to a recurring fight, then he doesn’t respect your feelings and needs. “Busy” is another word for “asshole.” “Asshole” is another word for the guy you’re dating. You deserve a fcking phone call."
love,"It was love at first sight, at last sight, at ever and ever sight."
love,"If you love somebody, let them go, for if they return, they were always yours. If they don't, they never were."
love,"I am not sure exactly what heaven will be like, but I know that when we die and it comes time for God to judge us, he will not ask, 'How many good things have you done in your life?' rather he will ask, 'How much love did you put into what you did?"
love,"Love is a fire. But whether it is going to warm your hearth or burn down your house, you can never tell."
love,"We’re all seeking that special person who is right for us. But if you’ve been through enough relationships, you begin to suspect there’s no right person, just different flavors of wrong. Why is this? Because you yourself are wrong in some way, and you seek out partners who are wrong in some complementary way. But it takes a lot of living to grow fully into your own wrongness. And it isn’t until you finally run up against your deepest demons, your unsolvable problems—the ones that make you truly who you are—that we’re ready to find a lifelong mate. Only then do you finally know what you’re looking for. You’re looking for the wrong person. But not just any wrong person: it's got to be the right wrong person—someone you lovingly gaze upon and think, “This is the problem I want to have.”I will find that special person who is wrong for me in just the right way."
love,"And now these three remain: faith, hope and love. But the greatest of these is love."
love,"My dear,Find what you love and let it kill you.Let it drain you of your all. Let it cling onto your back and weigh you down into eventual nothingness.Let it kill you and let it devour your remains.For all things will kill you, both slowly and fastly, but it’s much better to be killed by a lover.~ Falsely yours"
love,"You are the answer to every prayer I've offered. You are a song, a dream, a whisper, and I don't know how I could have lived without you for as long as I have."
love,"I have something I need to tell you,"" he says. I run my fingers along the tendons in his hands and look back at him. ""I might be in love with you."" He smiles a little. ""I'm waiting until I'm sure to tell you, though.""""That's sensible of you,"" I say, smiling too. ""We should find some paper so you can make a list or a chart or something.""I feel his laughter against my side, his nose sliding along my jaw, his lips pressing my ear.""Maybe I'm already sure,"" he says, ""and I just don't want to frighten you.""I laugh a little. ""Then you should know better.""""Fine,"" he says. ""Then I love you."
love,"If pain must come, may it come quickly. Because I have a life to live, and I need to live it in the best way possible. If he has to make a choice, may he make it now. Then I will either wait for him or forget him."
love,"More smiling, less worrying. More compassion, less judgment. More blessed, less stressed. More love, less hate."
love,"I can feel Peeta press his forehead into my temple and he asks, 'So now that you've got me, what are you going to do with me?' I turn into him. 'Put you somewhere you can't get hurt."
love,"Let there be spaces in your togetherness, And let the winds of the heavens dance between you. Love one another but make not a bond of love: Let it rather be a moving sea between the shores of your souls. Fill each other's cup but drink not from one cup. Give one another of your bread but eat not from the same loaf. Sing and dance together and be joyous, but let each one of you be alone, Even as the strings of a lute are alone though they quiver with the same music. Give your hearts, but not into each other's keeping. For only the hand of Life can contain your hearts. And stand together, yet not too near together: For the pillars of the temple stand apart, And the oak tree and the cypress grow not in each other's shadow."
love,Be the reason someone smiles. Be the reason someone feels loved and believes in the goodness in people.
love,Be careful of love. It'll twist your brain around and leave you thinking up is down and right is wrong.
love,How many slams in an old screen door? Depends how loud you shut it. How many slices in a bread? Depends how thin you cut it. How much good inside a day? Depends how good you live 'em. How much love inside a friend? Depends how much you give 'em.
love,"Love does not begin and end the way we seem to think it does. Love is a battle, love is a war; love is a growing up."
love,"It is good to love many things, for therein lies the true strength, and whosoever loves much performs much, and can accomplish much, and what is done in love is well done."
love,When love is not madness it is not love.
love,"If you like her, if she makes you happy, and if you feel like you know her---then don't let her go."
love,"I think... if it is true that there are as many minds as there are heads, then there are as many kinds of love as there are hearts."
love,"Well, it seems to me that the best relationships - the ones that last - are frequently the ones that are rooted in friendship. You know, one day you look at the person and you see something more than you did the night before. Like a switch has been flicked somewhere. And the person who was just a friend is... suddenly the only person you can ever imagine yourself with."
love,Declarations of love amuse me. Especially when unrequited.
love,"True love is rare, and it's the only thing that gives life real meaning."
love,I love you more than there are stars in the sky and fish in the sea.
love,A woman's heart should be so hidden in God that a man has to seek Him just to find her.
love,"What's this?"" he demanded, looking from Clary to his companions, as if they might know what she was doing there.""It's a girl,"" Jace said,recovering his composure. ""Surely you've seen girls before, Alec. Your sister Isabelle is one."
love,"Do you think I'm pretty?I think you're beautifulBeautiful?You are so beautiful, it hurts sometimes."
love,"The most painful thing is losing yourself in the process of loving someone too much, and forgetting that you are special too."
love,I love you. Remember. They cannot take it
love,"I loved her against reason, against promise, against peace, against hope, against happiness, against all discouragement that could be."
love,"I was smiling yesterday,I am smiling today and I will smile tomorrow.Simply because life is too short to cry for anything."
love,Love is an irresistible desire to be irresistibly desired.
love,أجمل حب هو الذي نعثر عليه أثناء بحثنا عن شيء آخر
inspiration,Do one thing every day that scares you.
inspiration,"We are what we pretend to be, so we must be careful about what we pretend to be."
inspiration,"When we love, we always strive to become better than we are. When we strive to become better than we are, everything around us becomes better too."
inspiration,"Sometimes you wake up. Sometimes the fall kills you. And sometimes, when you fall, you fly."
inspiration,"Hold fast to dreams,For if dreams dieLife is a broken-winged bird,That cannot fly."
inspiration,"And now here is my secret, a very simple secret: It is only with the heart that one can see rightly; what is essential is invisible to the eye."
inspiration,"If you're reading this...Congratulations, you're alive.If that's not something to smile about,then I don't know what is."
inspiration,What's meant to be will always find a way
inspiration,"We delight in the beauty of the butterfly, but rarely admit the changes it has gone through to achieve that beauty."
inspiration,The flower that blooms in adversity is the rarest and most beautiful of all.
inspiration,Attitude is a choice. Happiness is a choice. Optimism is a choice. Kindness is a choice. Giving is a choice. Respect is a choice. Whatever choice you make makes you. Choose wisely.
inspiration,"Courage is the most important of all the virtues because without courage, you can't practice any other virtue consistently."
inspiration,You never have to change anything you got up in the middle of the night to write.
inspiration,The unexamined life is not worth living.
inspiration,Don't be pushed around by the fears in your mind. Be led by the dreams in your heart.
inspiration,"Instead of worrying about what you cannot control, shift your energy to what you can create."
inspiration,"Take responsibility of your own happiness, never put it in other people’s hands."
inspiration,"It’s only after you’ve stepped outside your comfort zone that you begin to change, grow, and transform."
inspiration,I was never really insane except upon occasions when my heart was touched.
inspiration,"More smiling, less worrying. More compassion, less judgment. More blessed, less stressed. More love, less hate."
inspiration,"Respect other people's feelings. It might mean nothing to you, but it could mean everything to them."
inspiration,Be the reason someone smiles. Be the reason someone feels loved and believes in the goodness in people.
inspiration,Be mindful. Be grateful. Be positive. Be true. Be kind.
inspiration,"It is good to love many things, for therein lies the true strength, and whosoever loves much performs much, and can accomplish much, and what is done in love is well done."
inspiration,"Accept yourself, love yourself, and keep moving forward. If you want to fly, you have to give up what weighs you down."
inspiration,"Do what is right, not what is easy nor what is popular."
inspiration,"Life is too short to waste your time on people who don’t respect, appreciate, and value you."
inspiration,"If you want to be happy, do not dwell in the past, do not worry about the future, focus on living fully in the present."
inspiration,"The things you do for yourself are gone when you are gone, but the things you do for others remain as your legacy."
inspiration,Pain is temporary. Quitting lasts forever.
inspiration,"The past is a place of reference, not a place of residence; the past is a place of learning, not a place of living."
inspiration,Live the Life of Your Dreams: Be brave enough to live the life of your dreams according to your vision and purpose instead of the expectations and opinions of others.
inspiration,"It's not the load that breaks you down, it's the way you carry it."
inspiration,Life becomes easier and more beautiful when we can see the good in other people.
inspiration,"Don't let the expectations and opinions of other people affect your decisions. It's your life, not theirs. Do what matters most to you; do what makes you feel alive and happy. Don't let the expectations and ideas of others limit who you are. If you let others tell you who you are, you are living their reality — not yours. There is more to life than pleasing people. There is much more to life than following others' prescribed path. There is so much more to life than what you experience right now. You need to decide who you are for yourself. Become a whole being. Adventure."
inspiration,"You have power over your mind - not outside events. Realize this, and you will find strength."
inspiration,"Believe in yourself. You are braver than you think, more talented than you know, and capable of more than you imagine."
inspiration,"Make improvements, not excuses. Seek respect, not attention."
inspiration,"Don’t waste your time in anger, regrets, worries, and grudges. Life is too short to be unhappy."
inspiration,"Pursue what catches your heart, not what catches your eyes."
inspiration,Keep GoingYour hardest times often lead to the greatest moments of your life. Keep going. Tough situations build strong people in the end.
inspiration,Learn to light a candle in the darkest moments of someone’s life. Be the light that helps others see; it is what gives life its deepest significance.
inspiration,I dream my painting and I paint my dream.
inspiration,"Believe in Your HeartBelieve in your heart that you're meant to live a life full of passion, purpose, magic and miracles."
inspiration,"Be grateful for what you already have while you pursue your goals. If you aren’t grateful for what you already have, what makes you think you would be happy with more."
inspiration,"No amount of regretting can change the past, and no amount of worrying can change the future."
inspiration,"Acts of Kindness:A random act of kindness, no matter how small, can make a tremendous impact on someone else's life."
inspiration,"Don't JustDon't just learn, experience.Don't just read, absorb.Don't just change, transform.Don't just relate, advocate.Don't just promise, prove.Don't just criticize, encourage.Don't just think, ponder.Don't just take, give.Don't just see, feel.Don’t just dream, do. Don't just hear, listen.Don't just talk, act.Don't just tell, show.Don't just exist, live."
inspiration,"Follow your heart, listen to your inner voice, stop caring about what others think."
inspiration,Start each day with a positive thought and a grateful heart.
inspiration,"Life is about accepting the challenges along the way, choosing to keep moving forward, and savoring the journey."
inspiration,"Even if you cannot change all the people around you, you can change the people you choose to be around. Life is too short to waste your time on people who don’t respect, appreciate, and value you. Spend your life with people who make you smile, laugh, and feel loved."
inspiration,"Understanding is the first step to acceptance, and only with acceptance can there be recovery."
inspiration,"And still, after all this time,The sun never says to the earth,""You owe Me.""Look what happens withA love like that,It lights the Whole Sky."
inspiration,"You cannot control the behavior of others, but you can always choose how you respond to it."
inspiration,"Treat everyone with politeness and kindness, not because they are nice, but because you are."
inspiration,Top 15 Things Money Can’t BuyTime. Happiness. Inner Peace. Integrity. Love. Character. Manners. Health. Respect. Morals. Trust. Patience. Class. Common sense. Dignity.
inspiration,"You need to learn how to select your thoughts just the same way you select your clothes every day. This is a power you can cultivate. If you want to control things in your life so bad, work on the mind. That's the only thing you should be trying to control."
inspiration,There are years that ask questions and years that answer.
inspiration,"If you treat an individual as he is, he will remain how he is. But if you treat him as if he were what he ought to be and could be, he will become what he ought to be and could be."
inspiration,Be brave to stand for what you believe in even if you stand alone.
inspiration,"Success is not how high you have climbed, but how you make a positive difference to the world."
inspiration,Do you want to know who you are? Don't ask. Act! Action will delineate and define you.
inspiration,Do not fear failure but rather fear not trying.
inspiration,"Always find opportunities to make someone smile, and to offer random acts of kindness in everyday life."
inspiration,"What you do makes a difference, and you have to decide what kind of difference you want to make."
inspiration,Never lose hope. Storms make people stronger and never last forever.
inspiration,"You yourself, as much as anybody in the entire universe, deserve your love and affection"
inspiration,Love is the absence of judgment.
inspiration,Cry. Forgive. Learn. Move on. Let your tears water the seeds of your future happiness.
inspiration,"Time doesn’t heal emotional pain, you need to learn how to let go."
inspiration,To shine your brightest light is to be who you truly are.
inspiration,"The reason it hurts so much to separate is because our souls are connected. Maybe they always have been and will be. Maybe we've lived a thousand lives before this one and in each of them we've found each other. And maybe each time, we've been forced apart for the same reasons. That means that this goodbye is both a goodbye for the past ten thousand years and a prelude to what will come."
inspiration,Be thankful for everything that happens in your life; it’s all an experience.
inspiration,"I read once that the ancient Egyptians had fifty words for sand & the Eskimos had a hundred words for snow. I wish I had a thousand words for love, but all that comes to mind is the way you move against me while you sleep & there are no words for that."
inspiration,Sometimes you have to lose all you have to find out who you truly are.
inspiration,You are not rich until you have a rich heart.
inspiration,"Stop comparing yourself to other people, just choose to be happy and live your own life."
inspiration,You never change your life until you step out of your comfort zone; change begins at the end of your comfort zone.
inspiration,"Do not let the memories of your past limit the potential of your future. There are no limits to what you can achieve on your journey through life, except in your mind."
inspiration,"Ignore those that make you fearful and sad, that degrade you back towards disease and death."
inspiration,Let the improvement of yourself keep you so busy that you have no time to criticize others.
inspiration,You can't wait for inspiration. You have to go after it with a club.
inspiration,Do not set aside your happiness. Do not wait to be happy in the future. The best time to be happy is always now.
inspiration,To give pleasure to a single heart by a single act is better than a thousand heads bowing in prayer.
inspiration,"For me, I am driven by two main philosophies: know more today about the world than I knew yesterday and lessen the suffering of others. You'd be surprised how far that gets you."
inspiration,"Great things happen to those who don't stop believing, trying, learning, and being grateful."
inspiration,Help others without any reason and give without the expectation of receiving anything in return.
inspiration,Believe in your infinite potential. Your only limitations are those you set upon yourself.
inspiration,"Listen with curiosity. Speak with honesty. Act with integrity. The greatest problem with communication is we don’t listen to understand. We listen to reply. When we listen with curiosity, we don’t listen with the intent to reply. We listen for what’s behind the words."
inspiration,The soul is healed by being with children.
inspiration,Romance is the glamour which turns the dust of everyday life into a golden haze. 
inspiration,It’s your life; you don’t need someone’s permission to live the life you want. Be brave to live from your heart.
inspiration,"It was only a sunny smile, and little it cost in the giving, but like morning light it scattered the night and made the day worth living."
inspiration,The only thing standing between you and your goal is the bullshit story you keep telling yourself as to why you can't achieve it.
inspiration,"The more you feed your mind with positive thoughts, the more you can attract great things into your life."
inspiration,Be Brave and Take Risks: You need to have faith in yourself. Be brave and take risks. You don't have to have it all figured out to move forward.
inspiration,Happiness depends on your mindset and attitude.
inspiration,Do Not Lie to Yourself We have to be honest about what we want and take risks rather than lie to ourselves and make excuses to stay in our comfort zone.
inspiration,"Tomorrow will be better.”“But what if it’s not?” I asked.“Then you say it again tomorrow. Because it might be. You never know, right? At some point, tomorrow will be better."
inspiration,"Surround Yourself with People Who Believe in Your Dreams:Surround yourself with people who believe in your dreams, encourage your ideas, support your ambitions, and bring out the best in you."
inspiration,It's hard to beat a person who never gives up.
inspiration,"There is freedom waiting for you,On the breezes of the sky,And you ask ""What if I fall?""Oh but my darling,What if you fly?"
inspiration,"When you do the right thing, you get the feeling of peace and serenity associated with it. Do it again and again."
inspiration,"I've been in love before, it's like a narcotic. At first it brings the euphoria of complete surrender. The next day you want more. You're not addicted yet, but you like the sensation, and you think you can still control things.You think about the person you love for two minutes then forget them for three hours. But then you get used to that person, and you begin to be completely dependent on them. Now you think about him for three hours and forget him for two minutes. If he's not there, you feel like an addict who can't get a fix. And just as addicts steal and humiliate themselves to get what they need, you're willing to do anything for love.""- By the River Piedra I Sat Down and Wept"
inspiration,"Do what you love, love what you do, and with all your heart give yourself to it."
inspiration,"Do stuff. be clenched, curious. Not waiting for inspiration's shove or society's kiss on your forehead. Pay attention. It's all about paying attention. attention is vitality. It connects you with others. It makes you eager. stay eager."
inspiration,"Once you realize you deserve a bright future, letting go of your dark past is the best choice you will ever make."
inspiration,"When someone tells me ""no,"" it doesn't mean I can't do it, it simply means I can't do it with them."
inspiration,"If you believe very strongly in something, stand up and fight for it."
inspiration,The outer world is a reflection of the inner world. Other people’s perception of you is a reflection of them; your response to them is an awareness of you.
inspiration,"You can search throughout the entire universe for someone who is more deserving of your love and affection than you are yourself, and that person is not to be found anywhere. You, yourself, as much as anybody in the entire universe, deserve your love and affection."
inspiration,Our wounds are often the openings into the best and most beautiful part of us.
inspiration,"I have been and still am a seeker, but I have ceased to question stars and books; I have begun to listen to the teaching my blood whispers to me."
inspiration,"Always remember people who have helped you along the way, and don’t forget to lift someone up."
inspiration,"The only person who can pull me down is myself, and I'm not going to let myself pull me down anymore."
inspiration,"The greatest disease in the West today is not TB or leprosy; it is being unwanted, unloved, and uncared for. We can cure physical diseases with medicine, but the only cure for loneliness, despair, and hopelessness is love. There are many in the world who are dying for a piece of bread but there are many more dying for a little love. The poverty in the West is a different kind of poverty -- it is not only a poverty of loneliness but also of spirituality. There's a hunger for love, as there is a hunger for God."
inspiration,"So comes snow after fire, and even dragons have their endings."
inspiration,"Those who contemplate the beauty of the earth find reserves of strength that will endure as long as life lasts. There is something infinitely healing in the repeated refrains of nature -- the assurance that dawn comes after night, and spring after winter."
inspiration,"The animal merely makes a bed, which he warms with his body in a sheltered place; but man, having discovered fire, boxes up some air in a spacious apartment, and warms that, instead of robbing himself, makes that his bed, in which he can move about divested of more cumbrous clothing, maintain a kind of summer in the midst of winter, and by means of windows even admit the light and with a lamp lengthen out the day."
inspiration,It's never too late to change your life for the better. You don't have to take huge steps to change your life. Making even the smallest changes to your daily routine can make a big difference to your life.
inspiration,"Focus on your strengths, not your weaknesses.Focus on your character, not your reputation.Focus on your blessings, not your misfortunes."
